1,你们听见了吗？这是今日中国的声音今天清明，全国哀悼，你是否记得这些声音？清晨，天安门广场国歌响起后举行下半旗；10时，防空警报鸣响，汽车、轮船同时鸣笛…这一天，山河同悲，清明节响彻神州大地的声音，致敬英烈、告慰逝者。风雨过后，生活还将继续，生者自当勇毅前行！
3,打扰了借个楼，请关注先锋集团网信理财诈骗750亿 巨额诈骗案没人管，大量资金被转移到海外，法制社会幕后黑手只手遮天，
5,十几万受害人投诉无门，快一年了报案无果，朝阳经侦身为执法部门有法不依，纵容包庇诈骗犯逍遥法外
1,虽然多灾多难，但是长盛不衰，这就是中华民族呀。今日之中华 是吾辈之中华 无论有什么危险，祖国都会接你回家!此生不悔入华夏！
2,愿逝者安息，生者奋发图强！默默的流下了泪水！ 烟雨蒙蒙，或许连天也在为抗疫英雄而流泪 为什么我看到会流眼泪，为我们的祖国
1,春风已解千层雪，后辈难忘先烈恩 我们热爱祖国，祖国保护我们 武汉加油中国加油 真的是，国家现在这么强大，靠的就是前辈们负重前行。
2,我忍不住泪水。武汉的小伙伴，你内心的疼痛我也感受到了。严冬已过，春天的花芽探出了脑袋，召唤新生～ 昨日让我忍不住流泪，不知你们是否和我同样？
1,一个出英雄、尊敬英雄、宣传英雄、人人争当英雄的民族才是让世人尊重的民族。中华民族将永立世界民族之林
